Unnamed: 0.1,Unnamed: 0,eid,doi,title,year,citedby_count,cache_file_mdate,abstract
2873,2-s2.0-85135452623,2-s2.0-85135452623,10.3389/fchem.2022.942492,Recent progress on covalent organic framework materials as CO2 reduction electrocatalysts,2022,11,2024-12-19 14:42:20,carbon neutralization via various novel technology alleviate co2 c o level atmosphere thus become one major topic modern research field advanced technology cover co2 c o capture storage conversion etc . electrocatalytic co2 c o reduction reaction co2rr c o r r heterogeneous catalyst among promising method since could utilize renewable energy generate valuable fuel chemical covalent organic framework cof represent crystalline organic polymer highly rigid conjugate structure tunable porosity exhibit significant potential heterogeneous electrocatalyst co2rr c o r r review briefly introduce related pioneering work cof base material electrocatalytic co2rr c o r r recent year provide basis future design synthesis highly active selective cof base electrocatalyst direction
7603,2-s2.0-85117372447,2-s2.0-85117372447,10.1039/d1cy01170g,Revisiting trends in the exchange current for hydrogen evolution,2021,37,2024-12-19 15:44:45,herein focus hydrogen evolution reaction acidic medium revisit original experimental datum find fidelity kinetic model significantly improve invoke metal dependence onk0such logarithm ofk0linearly depend absolute value δgh confirm relationship use additional experimental data point obtain critical review available literature analysis show new model decrease discrepancy calculate experimental exchange current density value four order magnitude furthermore show model improve use machine learn statistical inference method integrate additional material property
8176,2-s2.0-85114287616,2-s2.0-85114287616,10.3390/catal11091083,Promotion effect of palladium on bivo4 sensing material for epinephrine detection,2021,8,2024-12-19 15:51:27,licensee mdpi basel switzerland.in study pdbivo4 pd bi v o composite prepare hydrothermal method electrochemical sensing material epinephrine x ray diffraction scan electron microscopy transmission electron microscope use characterize sample electrochemical detection system cyclic voltammetry differential pulse voltammetry apply measure concentration epinephrine solution 0.9–27.5 µm pdbivo4 pd bi v o coat glassy carbon electrode result oxidation peak current pdbivo4 / gce pd bi v o g c e demonstrate good linearity epinephrine concentration detection limit epinephrine concentration cyclic voltammetry differential pulse voltammetry 0.262 µm 0.154 µm respectively additionally propose sense material exhibit good reproducibility stability selectivity plausible sensing mechanism propose
656,2-s2.0-85136087801,2-s2.0-85136087801,10.1038/s41467-022-32601-9,Structural evolution and strain generation of derived-Cu catalysts during CO2 electroreduction,2022,104,2024-12-18 16:34:30,however origin selectivity influence catalyst precursor fully understand combine operando x ray diffraction operando raman spectroscopy monitor structural compositional evolution three cu precursor co2rr c o r r result indicate despite different kinetic three precursor completely reduce cu similar grain size ~11 nm oxidize cu specie involve co2rr c o r r furthermore cu oh cu2 cu oh 2co3 derive cu exhibit considerable tensile strain 0.43 ~0.55 whereas cuo derive cu theoretical calculation suggest tensile strain cu lattice conducive promote co2rr c o r r consistent experimental observation high co2rr c o r r performance derive cu catalyst attribute combined effect small grain size lattice strain originate situ electroreduction precursor finding establish correlation cu precursors lattice strain catalytic behavior demonstrate unique ability operando characterization study electrochemical process
7288,2-s2.0-85127368445,2-s2.0-85127368445,10.1039/d1ta08241h,High-loading metal atoms on graphdiyne for efficient nitrogen fixation to ammonia†,2021,27,2024-12-19 15:40:52,graphdiyne base atomic catalyst emerge new class promising material catalysis new graphdiyne base manganese atomic electrocatalyst mnsagdy design successfully synthesize via facile situ reduction strategy electrochemical nitrogen fixation ammonia experimental result reveal single mn atom successfully anchor highly dispersed surface gdy form catalyst determine chemical structure facilitate charge transfer capability maximize active site special characteristic provide mnsagdy high ammonia yield rate 46.78 μg h−1 mgcat.−1 faradaic efficiency 39.83 well cycling durability outperform report conventional atomic electrocatalyst heterostructure one work broaden application scope gdy base atomic catalyst demonstrate applicability field energy conversion
274,2-s2.0-85144908895,2-s2.0-85144908895,10.3390/aerospace9120799,Flight Time Optimization and Modeling of a Hybrid Gasoline–Electric Multirotor Drone: An Experimental Study,2022,5,2024-12-18 16:30:53,batteries power drone consider inadequate power source due low energy density gasoline energy dense source combine electric propulsion system gasoline engine consider paper propose novel hybrid multirotor drone design use two gasoline engine provide majority lift force four electric motors stabilize drone propulsion system characterize optimize exploit respective advantage reduce total energy consumption rate increase flight time simulation experimental result show hybrid gaselectric multirotor drone achieve three time flight time fully electric drone
1746,2-s2.0-85139813068,2-s2.0-85139813068,10.3390/ijms231911282,Carbon-Based Electrocatalyst Design with Phytic Acid—A Versatile Biomass-Derived Modifier of Functional Materials,2022,7,2024-12-19 14:23:07,carbon material employ advanced electrode catalyst increase accessibility efficient economical energy conversion storage solution base electrocatalysis particular carbon material derive biomass promise candidate replace precious metal base catalyst owe low cost anti corrosion property electrochemical durability sustainability catalytic application rational design engineering functional carbon material term structure morphology heteroatom dope crucial phytic acid derive natural abundant renewable resource represent versatile carbon precursor modifier introduce tune aforementioned property review discuss synthetic strategy prepare functional carbon material use phytic acid explore influence precursor result material physicochemical characteristic also summarize recent strategy apply improve oxygen reduction performance porous carbon material use phytic acid thereby offer guidance future design functional sustainable carbon material enhance catalytic property
4260,2-s2.0-85126901087,2-s2.0-85126901087,10.1002/cssc.202102506,Copper Carbonate Hydroxide as Precursor of Interfacial CO in CO2 Electroreduction,2022,26,2024-12-19 15:00:55,chemsuschem publish wiley vch gmbh.copper electrode especially effective catalysis c2 c multi carbon product co2 c o reduction reaction co2rr c o r r therefore major technological interest reason unparalleled cu performance co2rr c o r r insufficiently understand electrodeelectrolyte interface highlight dynamic physical chemical system determinant catalytic event exploit intrinsic surface enhance raman effect previously characterize cu foam electrode operando raman experiment use interrogate structure molecular interaction electrodeelectrolyte interface subcatalytic catalytic potential formation copper carbonate hydroxide cucarhyd detect resemble mineral malachite carbonate ion could directly convert co low overpotential experiment suggest basic mode co2 / carbonate c o reduction cu electrode interface contrast previous mechanistic model start point carbon reduction co2 c o carbonate ion bind metallic cu electrode form cucarhyd structure hypothesize cu oxides residue could enhance co2rr c o r r indirectly support formation cucarhyd motifs presence cucarhyd patch catalytic potential might result alkalization conjunction local electrical potential gradient enable formation metastable cucarhyd motif large range potential
2875,2-s2.0-85135900257,2-s2.0-85135900257,10.1021/acs.jpcc.2c01107,Oxygen and Proton Transport in Flooded Graphene Pores with N-Dopants and Defects,2022,2,2024-12-19 14:42:21,oxygen reduction reaction catalyze ptc proton exchange membrane fuel cell cathode o2 o h delivery pt surface h2o h o transport away require pt nanoparticle may accessible via micropore small ionomer molecule enter possibly require flood h transport test bury pt particle play role activity propose transport mechanism perform atomic scale simulation base reactive force field molecular dynamic emphasis confinement å . diffusion coefficient function molar concentration local environment evaluate water domain confine two dimensional graphene nanochannel various channel height represent morphological model micropore proton exchange fuel cell cathode study show local atomic scale structure strongly modify h o2 o h2o h o transport rate flood micropore less å size find critical crossover diffusion behavior around å space large pore bulk like diffusion property confinement å monotonically decrease diffusion rate pore size decrease observe locally disperse water region ultimately strand reactant long distance transport finding suggest flood micropore may fact viable transport pathway relevant reactant product pore wall opposite side remain separated ≥10 å separation furthermore confinement effect strong n doping c vacancy defect c pore wall minimal impact diffusion rate effect counterintuitively apparent large spacing finding provide valuable insight regard cathode performance role strand catalyst particle may play fuel cell cathode
3761,2-s2.0-85131803014,2-s2.0-85131803014,10.3389/fbioe.2022.895107,Oriented Growth of Neural Stem Cell–Derived Neurons Regulated by Magnetic Nanochains,2022,5,2024-12-19 14:53:53,owe anisotropy nervous system newly derive neuron need functional integrity also orient growth contact partner cell establish functional connection orient growth newly derive neuron key factor neural stem cellbase nerve regeneration nowadays various biomaterial apply assist orient growth neural stem cellderive neuron however among biomaterial magnetic material apply guide neuronal growth still few material fiber work develop magnetic nanochain guide orient growth neural stem cellderive neuron guidance magnetic nanochain seed neural stem cell exhibit good arrangement neural stem cellderive neuron show well orient growth orientation nanochain anticipate magnetic nanochain would huge potential stem cellbase nerve regeneration
3333,2-s2.0-85133615949,2-s2.0-85133615949,10.1039/d2qi00892k,Bifunctional atomically dispersed ruthenium electrocatalysts for efficient bipolar membrane water electrolysis,2022,23,2024-12-19 14:48:14,herein report electrocatalytic performance atomically disperse ruthenium catalyst ru adcs ultralow ru loading 0.2 wt obtain ru adcs ru 0.2 nc active hydrogen evolution reaction oxygen evolution reaction oer require low overpotential η 47.1 72.8 mv deliver cm−2 0.5 h2so4 h s o 1.0 koh respectively mv oer 1.0 koh show favorable bifunctionality density functional theory dft calculation reveal ru n bonding play important role lower energy barrier reaction boost oer activity furthermore bipolar membrane bpm water electrolysis use bifunctional ru 0.2 nc oer catalyst afford cm−2 low cell voltage 0.89 v show performance decay upon h continuous operation show great potential energy save hydrogen production
4810,2-s2.0-85127000475,2-s2.0-85127000475,10.5599/jese.1166,Electrodeposited palladium as efficient electrocatalyst for hydrazine and methanol electrooxidation and detection,2022,7,2024-12-19 15:08:16,electrochemical behavior electrode evaluate cyclic voltammetry cv electroanalytical property determine differential pulse voltammetry dpv electrodeposite pd catalyst exhibit good electrocatalytic activity towards oxidation hydrazine neutral solution methanol oxidation alkaline solution optimize dpv condition electrodeposite pd electrode show good sensing capability hydrazine methanol detection
3249,2-s2.0-85128477999,2-s2.0-85128477999,10.1007/s11581-022-04567-7,Carbon Nanotube prepared by catalytic pyrolysis as the electrode for supercapacitors from polypropylene wasted face masks,2022,33,2024-12-19 14:47:12,"meantime incineration landfill discard face mask would result severe environmental pollution infectious hazards herein suggestion recycle polypropylene waste mask cnt environmentally friendly high add value disposal process propose prepare supercapacitor electrode material energy storage attempt cnt prepare waste mask catalysis pyrolysis nife bimetallic catalyst especially bamboo like structure cnt obtain nife molar ratio structure own high specific capacitance compare standard cnt specific capacitance could reach 56.04 fg ag excellent cycling stability capacitance retention rate material 85.41 10,000 cycle besides assemble capacitor possess good energy density 4.78 whkg power density wkg thus work provide sustainable cost effective strategy dispose waste mask high valuable cnt potential application supercapacitor also study exploit would provide new idea recycling utilize polypropylene waste medical device graphical abstract figure available see fulltext"
6588,2-s2.0-85140242785,2-s2.0-85140242785,10.1016/j.ccst.2021.100016,Boron Carbon Nitride Semiconductor Modified with CeO2 for Photocatalytic Reduction of CO2 with H2O: Comparative Study,2021,5,2024-12-19 15:31:32,however fast electron hole recombination well weak absorption ultraviolet visible uv vis light still challenge activity upgrade bcn paper bcnceo2 b c n ce o heterostructure via n ce bonding fabricate urea assistant heat precipitation technique confirm xrd ft ir sem tem xps characterization co2 c o photoreduction h2o h o reduce agent bcnceo2 b c n ce o heterostructure deliver obviously enhance catalytic performance co yield can fold bcn uv vis diffuse reflectance spectrophotometer drs electrochemical impedance spectroscopy eis transient photocurrent response measurement reveal electron hole separation efficiency charge transfer efficiently promote ceo2 / bcn ce o b c n heterostructure along boost light harvesting visible ultraviolet light range furthermore base photo electro chemical photocatalytic result possible co2 c o photocatalytic reduction mechanism propose
2441,2-s2.0-85136847271,2-s2.0-85136847271,10.1039/d2ta04485d,Evolution of bismuth-based metal-organic frameworks for efficient electroreduction of CO2,2022,7,2024-12-19 14:36:32,"describe three bi iii material mfm mfm mfm construct ligand biphenyl 3,3′,5,5′ tetracarboxylic acid show distinct porosity solvent accessible voids 49.6 33.6 respectively report first study impact porosity mof evolution electrocatalyst faradaic efficiency 90.4 −1.1 v vs. rhe reversible hydrogen electrode observe formate production electrode decorate mfm p form mfm application external potential presence 0.1 khco3 k h c o electrolyte situ electron paramagnetic resonance spectroscopy confirm presence cooh radical reaction intermediate observe stable consistent faradaic efficiency current density production formate electrolysis h. study emphasise significant role porosity mof react evolve electroreduction co2 c o generate value add chemical"
3847,2-s2.0-85130943072,2-s2.0-85130943072,10.3389/fchem.2022.861604,Electrocatalytic Water Oxidation: An Overview With an Example of Translation From Lab to Market,2022,37,2024-12-19 14:55:08,thus development efficient abundant economical catalyst well electrode design demand today review discuss principle electrocatalytic water oxidation reaction wor electrocatalyst electrode design strategy efficient result recent advancement oxygen evolution reaction oer catalyst design finally discuss use oer oxygen maker om design example om redox solaire initiative private ltd review clearly summarize future direction application sustainable energy utilization help water splitting way forward develop well cell design electrode catalyst practical application hope review offer basic understand oer process wor general along standard parameter evaluate performance encourage wor base profound innovation make way lab market follow example om redox
6971,2-s2.0-85108535727,2-s2.0-85108535727,10.1016/j.jechem.2021.06.008,Porous catalytic membranes for CO2 conversion,2021,14,2024-12-19 15:36:35,various material apply reduce co2 c o fuel value add chemical normally powder base catalyst directly utilize co2 c o conversion much attention pay study catalytic membrane order overcome issue since convenient catalytic membrane employ device practical application review recent research development porous catalytic membrane co2 c o conversion summarize preparation representative porous catalytic membrane co2 c o conversion method include electrocatalysis photocatalysis photoelectrocatalysis thermalcatalysis biocatalysis discuss detail review expect provide deep understand utilization porous catalytic membrane co2 c o conversion
3995,2-s2.0-85129893670,2-s2.0-85129893670,10.3390/nano12091518,Understanding the CH4 Conversion over Metal Dimers from First Principles,2022,2,2024-12-19 14:57:12,licensee mdpi basel switzerland.inspire advantage bi atom catalyst recent exciting progress nanozyme mean density functional theory dft computation explore potential metal dimer embed phthalocyanine monolayers m2 m pc mimic binuclear center methane monooxygenase catalyst methane conversion use h2o2 h o oxidant total transition metal group ib viiib four main group metal al ga sn bi dimers consider two methane conversion route namely assist oh assist mechanism systematically study result show methane conversion proceed via oh assist mechanism ti2 ti pc zr2 zr pc ta2 ta pc combination oh assist mechanism surface sc2 sc pc respectively theoretical work may provide impetus develop new catalyst methane conversion help stimulate study metal dimer catalyst catalytic reaction
3043,2-s2.0-85136345167,2-s2.0-85136345167,10.3390/catal12070800,Enhancement on PrBa0.5Sr0.5Co1.5Fe0.5O5 Electrocatalyst Performance in the Application of Zn-Air Battery,2022,4,2024-12-19 14:44:26,prba0.5sr0.5co1.5fe0.5o5 pr ba sr co fe o pbscf double perovskite adopt due flexible electronic structure well higher electro catalytic activity study pbscf prepare citrate edta method optimize amount pbscf ptc composite use potential orroer bifunctional electrocatalyst 0.1 koh optimize composite exhibit excellent oer intrinsic activity onset potential 1.6 v tafel slope mvdec o2 o saturate 0.1 koh also exhibit relatively competitive orr activity onset potential 0.9 v half wave potential 0.78 v. additionally znair battery pbscf composite catalyst show relatively good stability result illustrate pbscf ptc composite promising bifunctional electrocatalyst rechargeable zn air battery
5438,2-s2.0-85122851454,2-s2.0-85122851454,10.14233/ajchem.2022.23483,Photocatalytic Degradation of Rhodamine B and Malachite Green by Cobalt Sulfide Nanoparticles,2022,1,2024-12-19 15:16:13,license let other distribute remix tweak build upon work even commercially long credit author original creation must give appropriate credit provide link license indicate change made.present study report simple cost effective thermolytic method synthesis cobalt sulphide nanoparticle cos nps pxrd spectrum cobalt sulphide cd nanoparticle exhibit four peak index crystal plane average particle size observe dls pxrd range 4.81 12.20 nm blue shift band gap observe uv visible spectra fesem tem study reveal cobalt sulfide nanoparticle cubic rectangle shape ftir spectra hexadecylamine hda cap cos nps exhibit ν n h absorption around cm stretching frequency due ν cos appear region cm proton nmr 1h spectra cos nps show signal nearly position case cap agent suggest cap nature esi ms analysis cobalt sulphide nanoparticle display peak mz 124.93 correspond cos2 co s ion thermogravimetric curve show single step decomposition correspond 84.28 weight loss 15.72 final residue due cobalt oxide degradation rate rhodamine b malachite green dye irradiating sunlight show degradation irradiate uv light 4.8 ev show much slow degradation rate
4166,2-s2.0-85123061243,2-s2.0-85123061243,10.1016/j.fuproc.2022.107174,Hierarchical Ni3S2@2D Co MOF nanosheets as efficient hetero-electrocatalyst for hydrogen evolution reaction in alkaline solution,2022,44,2024-12-19 14:59:26,herein novel hierarchical hetero electrocatalyst ni3s2 ni s 2d co mof synthesized cobalt metal organic framework co mof crystallization carbon paper cp situ electrodeposition ni3s2 ni s nanosheet catalyst ni3s2 ni s 2d co mofcp exhibit excellent hydrogen evolution reaction activity low overpotential mv small tafel slope 90.3 mv dec−1 current density cm−2 catalyst demonstrate low overpotential mv commercial ptc catalyst high current density cm−2 efficient stable performance ni3s2 ni s 2d co mofcp attribute nickel sulfide honeycomb nanosheet grow two dimensional mof framework conducive charge transfer hydrogen evolution electron rich nickel sulfide surface significantly diminish h adsorption reduce energy barrier h2 h generation promote process work provide new strategy practical preparation efficient stable transition metal electrocatalyst
1187,2-s2.0-85142420234,2-s2.0-85142420234,10.3390/nano12224006,"Influence of Cocatalysts (Ni, Co, and Cu) and Synthesis Method on the Photocatalytic Activity of Exfoliated Graphitic Carbon Nitride for Hydrogen Production",2022,5,2024-12-19 14:15:51,synthesize catalyst test hydrogen production use w xe lamp equip nm cutoff filter noncommercial double walled quartz glass reactor irradiate side use gl catalyst ml vol triethanolamine aqueous solution preliminary screening metal load ex g cn synthesized use incipient wetness impregnation method high hydrogen production observe ni load ex g cn select assess impact synthesis method hydrogen production ni load ex g cn synthesize use different synthesis method incipient wetness impregnation colloidal deposition precipitation deposition catalyst characterize x ray powder diffraction x ray photoelectron spectroscopy nitrogen adsorption use brunaueremmettteller method transmission electron microscopy ni load ex g cn synthesized use colloidal method perform good hydrogen production rate 43.6 µmol h−1 g−1 contrast catalyst synthesize use impregnation precipitation method less active 28.2 10.1 µmol h−1 g−1 respectively hydrogen production performance suspend catalyst µmol m−2 g−1 show superior corresponding immobilize catalyst µmol m−2 g−1
5057,2-s2.0-85122624390,2-s2.0-85122624390,10.1016/j.catcom.2022.106404,Stable and efficient hydrogen evolution reaction catalyzed by NiO-Rh2P heterostructure electrocatalyst,2022,10,2024-12-19 15:11:27,due high capability water dissociation nio mv overpotential demand achieve cm−2 nio rh2p rh p mv low rh2p rh p alkaline catalysis besides strong electronic interplay nio rh2p rh p also contribute robust stability nio rh2p rh p heterostructure electrocatalyst
154,2-s2.0-85134642456,2-s2.0-85134642456,10.1049/ipr2.12596,Spotting micro-movements in image sequence by introducing intelligent cubic-LBP,2022,5,2024-12-18 16:29:39,iet image processing publish john wiley sons ltd behalf institution engineer technology.invisible naked human eye micro movement barely noticeable wide range micro movement application spot subtle change volcano vascular pulse blood vessel micro expression detection latter evil thought unveil result identify crook lawbreaker arise involuntary subtle short duration facial muscle movement precise spot tiny movement possible multiple aspect temporal image scrutinize meanwhile since motion often happen one two direction rudimentary extract complete feature set textural base approach cubic local binary pattern cubic lbp approach like cubic lbp also impose unnecessary computation burden hence research novel method name intelligent cubic lbp propose incorporate convolutional neural network cnn model model learn select useful plane automatically apex detect apply partial autocorrelation coefficient pacf select plane experimental result show significant improvement micro movement identification accuracy apex frame detection elevate chinese academy sciences micro expressions casme casme ii database respectively
1328,2-s2.0-85138202979,2-s2.0-85138202979,10.1002/ente.202200835,Nonthermal Plasma-Modified Carbon-Carrying Sn-Based Ternary Nanocatalyst for High-Performance Direct Dimethyl Ether Fuel Cells,2022,7,2024-12-19 14:17:34,however micropore present vulcan xc72 x c limit fuel utilization cause pt agglomeration vulcan xc72 x c compose nongraphitize carbon specie also prone corrosion therefore herein carbon support multiwalle carbon nanotube mwcnt black pearl bp2000 b p cold n2 n plasma treat counterpart test enhance activity catalyst systematically describe comparative advantage vulcan xc carbon electroanalytical test show pt3pd3sn2 / bp2000 pt pd sn b p exhibit excellent performance term electrochemical active surface area peak current density dme oxidation charge beneficial effect plasma activation activity observe case mwcnt negative effect carbon laboratory fuel cell test indicate pt3pd3sn2 pt pd sn nanoparticle support optimize binary carbon support contain plasma activate mwcnt bp2000 b p pt3pd3sn2/75m25b pt pd sn m b provide highest report power density mw mg−1pgm c fuel cell temperature ambient pressure
