Unnamed: 0.1,Unnamed: 0,eid,doi,title,year,citedby_count,cache_file_mdate,abstract
2494,2-s2.0-85127732250,2-s2.0-85127732250,10.1016/j.apcatb.2022.121351,Critical thinking on baseline corrections for electrochemical surface area (ECSA) determination of Pt/C through H-adsorption/H-desorption regions of a cyclic voltammogram,2022,55,2024-12-19 14:37:12,conventionally ecsa calculate use area h adsorption h desorption hde region calculate correspond charge use appropriate baseline double layer region highly important accurate determination associate charge unlike pure platinum horizontal baseline double layer region appropriate ptc catalyst skewed baseline double layer region due presence surface functional group support carbon skewness similar negative go cathodic positive go anodic scan lead significantly different hde charge baseline carbon may vary significantly catalyst durability study accelerate stress test ast due oxidation support carbon present study investigate effect baseline contribution ecsa calculation ptc observe baseline contribution charge calculation depend nature carbon support significantly high value ~10 fold hde compare ii increase region number stress cycle ast hence ptc catalyst use constant current baseline close approximation true baseline charge associate use calculation ecsa access catalyst activity well durability term ecsa loss ast
5338,2-s2.0-85125010976,2-s2.0-85125010976,10.3390/mi13020304,Electrochemical Sensing of Glucose Using Glucose Oxidase/PEDOT:4-Sulfocalix [4]arene/MXene Composite Modified Electrode,2022,38,2024-12-19 15:14:54,"licensee mdpi basel switzerland.glucose one important monosaccharide find food part complex structure primary energy source brain body thus monitor glucose concentration important food biological sample order maintain healthy lifestyle herein electrochemical glucose biosensor fabricate immobilization glucose oxidase gox onto poly 3,4 ethylenedioxythiophene : 4 sulfocalix arene pedot scx mxene modify electrode purpose firstly pedot synthesize presence scx counterion chemical oxidative method secondly mxene 2d layered material synthesize use high temperature furnace nitrogen atmosphere pedot scxmxene 1:1 dispersion prepare ultrasonication later utilize prepare pedot scxmxene hybrid film successful formation pedot scxmxene film confirm hr sem fouri transform infrared ft ir raman spectroscopy due biocompatibility nature successful immobilization gox carry onto chitosan modify pedot scxmxenegce moreover electrochemical property pedot scxmxenegoxgce study cyclic voltammetry amperometry method interestingly stable redox peak fad gox observe formal potential – 0.435 v pedot scxmxenegoxgce indicate direct electron transfer enzyme electrode surface pedot scxmxenegoxgce also exhibit linear response glucose concentration linear range 0.5 mm effect ph sensor reproducibility repeatability pedot scxmxenegoxgce sensor study finally new biosensor successfully apply detect glucose commercial fruit juice sample satisfactory recovery"
5571,2-s2.0-85120801696,2-s2.0-85120801696,10.1016/j.ijhydene.2021.11.127,Enhancement of the electrocatalytic activity for the oxygen reduction reaction of boron-doped reduced graphene oxide via ultrasonic treatment,2022,13,2024-12-19 15:18:03,last decade organic material frequently base graphitic structure demonstrate promise alternative electrocatalyst noble metal researcher typically utilize ultrasonic treatment part synthesis procedure achieve homogeneous dispersion graphitic carbon prior herein investigate implication structural compositional change induce ultrasonication treatment boron dope reduce graphene oxide oxygen reduction reaction show ultrasonication pre treatment prior boron doping reduction graphene oxide via hydrothermal process step lead increase substitutional b electrocatalytic surface area associate reduction average pore size diameter lead significant improvement oxygen reduction reaction performance respect non ultrasonicated material propose high degree substitutional doping boron result formation additional epoxy functionality graphitic plane act doping site boric acid
5450,2-s2.0-85122510564,2-s2.0-85122510564,10.1007/s11244-021-01546-6,In-Silico Screening the Nitrogen Reduction Reaction on Single-Atom Electrocatalysts Anchored on MoS2,2022,8,2024-12-19 15:16:24,anchor single atom two dimensional substrate provide control tune nrr catalytic performance toward sac possess high utilization high activity high selectivity experimental result suggest significantly improve activity selectivity nrr specific reaction mechanism remain uncertain make difficult select new catalytic material optimization use density functional theory study nrr catalytic mechanism catalytic model use mos2 mo s substrate support single atom site correct solvation effect electrochemical reaction start fe mos2 mo s promise experimental report conduct systematic study nrr reaction mechanism result show n2 n adsorption hydrogenation n2 n desorption nh3 n h hydrogen evolution critical step affect reaction rate base step scan transition metal element find improved catalyst identify ir mos2 mo s mo top site good candidate predict good catalytic activity selectivity 64.11 faraday efficiency result mechanism nrr silico search alternative catalyst provide new promising target synthesize novel efficient sac mos2 mo s nrr catalyst
8787,2-s2.0-85101326609,2-s2.0-85101326609,10.1016/j.jallcom.2021.159092,Low-temperature processing technique of Ruddlesden-Popper cathode for high-performance solid oxide fuel cells,2021,14,2024-12-19 15:59:24,however take full advantage intrinsic property difficult realistic cell high chemical reactivity electrolyte elevated temperature herein demonstrate high performance sofc lno base cathode fabricate low temperature processing route suppress harmful chemical reaction sinter capability composite cathode compose lno gadolinia dope ceria gdc enhance mix fe base sinter additive gdc form reliable interfacial bonding electrolyte temperature ~200 c typical processing temperature interdiffusion cathode electrolyte occur low temperature cell successfully fabricate without diffusion block layer simplifie cell structure manufacturing process cell lno base cathode outperform state art cell particularly lower operating temperature result highlight processing parameter strongly affect electrochemical performance lno base cathode must carefully engineer fully exploit superior intrinsic property
7047,2-s2.0-85102741542,2-s2.0-85102741542,10.1002/smll.202007760,Correlating Catalyst Design and Discharged Product to Reduce Overpotential in Li-CO2 Batteries,2021,29,2024-12-19 15:37:39,however battery feasibility hamper inferior electrochemical performance due large overpotential low cyclability primarily cause difficult decomposition ultra stable li2co3 li c o charge use cathode catalyst highlight promising solution catalyst property well nature discharge product closely correlate electrochemical performance catalyst design strategy include active site enrichment electrical transport enhancement mass transfer improvement summarize catalyst effect product decomposition subsequently introduce product geometry chemical composition explore emphasis formationdecomposition li2c2o4 li c o instead li2co3 li c o build previous research future direction facilitate improvement catalyst design put forward reinforce fundamental development li co2 c o battery
2489,2-s2.0-85128210041,2-s2.0-85128210041,10.1016/j.ceja.2022.100303,Highly Efficient Hydrogen Evolution in Alkaline Medium by Ternary Cobalt Molybdenum Nitride on Self-standing Porous Copper Foam,2022,4,2024-12-19 14:37:09,hydrogen generation alkaline environment desirable challenging electrocatalyst report alkaline hydrogen evolution reaction generally suffer large potential short durability herein construct self stand ternary cobalt molybdenum nitride catalyst copper foam use simple hydrothermal method treat h2 h atmosphere subsequently remarkably conmo2ncu co n mo n cu catalyst exhibit ultralow overpotential mv mv current density cm−2 cm−2 1.0 koh respectively addition ternary catalyst achieve superior durability h current density cm−2 without evident deterioration indicate catalyst encourage industrial perspective
4670,2-s2.0-85120877238,2-s2.0-85120877238,10.1002/er.7481,Recent progress of battery grade metal sulfides for hybrid energy storage devices,2022,12,2024-12-19 15:06:23,metal sulfide composite among electrode material owe viable electrochemical characteristic recognize important contender hybrid device regard work report recently utilize single binary ternary composite metal sulfide battery grade electrode material hesds along synthesis route include hydrothermal electrodeposition solvothermal microwave sonochemical process apart different electrochemical characterization cyclic voltammetry cv electrochemical impedance spectroscopy eis galvanostatic charge discharge gcd confer review furthermore electrochemical performance sulfide base hesds compare summarize high energy outcome current challenge future prospect metal sulfide electrode material also discuss
7989,2-s2.0-85111149768,2-s2.0-85111149768,10.1039/d1ta03652a,Photothermal effect enables markedly enhanced oxygen reduction and evolution activities for high-performance Zn-air batteries,2021,41,2024-12-19 15:49:12,despite recent grand advance development synthetic technique overall performance electrocatalytic process enter bottleneck stage focus design modification bifunctional catalyst material herein report simple yet robust strategy markedly boost performance zabsviacapitalize photothermal effect concretely bifunctional electrocatalyst comprise co3o4nanoparticle co o encapsulate within n dope reduce graphene oxide denote co3o4 / n co o n rgo act active material photothermal component upon light illumination compelling photothermal effect co3o4 / n co o n rgo render localized instant heating electrode active site enhance electrical conductivity improve release bubble prominently reduce indicator δeof 0.635 v realize significantly outperform recently report system usually 0.68 v correspond rechargeable zab base co3o4 / n co o n rgo air electrode possess excellent maximum power density mw cm−2 1.8 time ptru base zabs assist photothermal effect superb cycling stability cycle intensification strategy open vast possibility ameliorate performance catalystsviainnovatively conveniently utilize photothermal feature may advance future application high performance zab energy conversion storage system
7893,2-s2.0-85098133416,2-s2.0-85098133416,10.1002/eem2.12140,Approaching High-Performance Lithium Storage Materials by Constructing Hierarchical CoNiO2@CeO2 Nanosheets,2021,137,2024-12-19 15:48:00,ceo2 ce o nanoparticle successfully deposit surface conio2 co ni o nanosheet benefit improvement electrical contact conio2 co ni o ceo2 ce o ceo2 ce o modification improve reversibility insertionextraction li ion electrochemical reaction activity promote transport li ion benefit unique architecture component conio2 co ni o ceo2 ce o nanosheet composite show high reversible capacity excellent cycling stability good rate capability conio2 co ni o ceo2 ce o 5.0 wt show chargedischarge capacity 867.1/843.2 mah g−1 cycle g−1 pristine conio2 co ni o ceo2 ce o nanosheet deliver chargedischarge capacity 516.9/517.6 mah g−1 cycle first principle calculation reveal valid interface ceo2 ce o nicoo2 ni co o form formation process interface exothermic strong interfacial interaction result excellent structure stability thus cycle stability conio2 co ni o ceo2 ce o material work provide effective strategy develop high performance anode material advanced lithium ion battery conio2 co ni o ceo2 ce o nanosheet show sizeable potential anode material next generation high energy li ion battery
7186,2-s2.0-85119439841,2-s2.0-85119439841,10.1021/acsami.1c15051,Covalent grafting of ruthenium complexes on iron oxide nanoparticles: Hybrid materials for photocatalytic water oxidation,2021,4,2024-12-19 15:39:30,herein report efficient hybrid photocatalyst water oxidation consist ruthenium polypyridyl complex covalently graft coreshell fe feox nanoparticle via phosphonic acid group photoelectrochemical measurement perform sun illumination koh photocurrent density hybrid photoanode reach μacm2 apply potential +1.0 v vs reversible hydrogen electrode correspond turnover frequency 0.02 performance represent fold enhancement achieve mixture fe feox nanoparticle linker free ruthenium polypyridyl photosensitizer increase performance could attribute efficient electron transfer ruthenium photosensitizer fe feox catalyst consequence covalent link two specie phosphonate pendant group
6847,2-s2.0-85116039387,2-s2.0-85116039387,10.1038/s41598-021-97801-7,"Anodic electrosynthesis of MIL-53(Al)-N(CH2PO3H2)2 as a mesoporous catalyst for synthesis of novel (N-methyl-pyrrol)-pyrazolo[3,4-b]pyridines via a cooperative vinylogous anomeric based oxidation",2021,36,2024-12-19 15:34:54,"anodic electrosynthesis environmentally friendly procedure perform aqueous solution room temperature atmospheric pressure short reaction time min also employ procedure accomplish without need ex situ salt baseprobase additive cation source ligand activate agent constant current mode 10.0 cm−2 electrosynthesize mof functionalize phosphoru acid tag novel mesoporous catalyst mesoporous catalyst successfully employ synthesis new series n methyl pyrrol pyrazolo 3,4 b pyridine one pot condensation reaction methyl phenyl 1h pyrazol amine methyl 1h pyrrol yl oxopropanenitrile various aromatic aldehyde mono bis tripodal catalyst proceed organic synthetic reaction via cooperative vinylogous anomeric base oxidation mechanism marginal decrease catalytic activity recycling reusability"
7838,2-s2.0-85111673655,2-s2.0-85111673655,10.1016/j.jssc.2021.122441,Low-temperature hydrogen reduction of iron oxide by controlling the water potential using a CaH2 drying agent,2021,5,2024-12-19 15:47:26,study cah2 can h use dry agent control partial pressure water vapor low reduction potential iron oxide compare extent formation reduction product α fe fe3o4 fe o reduce hydrogen without cah2 can h various temperature presence cah2 can h show low temperature require complete reduction c c accompanied increase h2 / h2o h h o ratio outlet gas thermodynamic calculation indicate addition cah2 can h increase reduction potential cause high production ratio α fe finding indicate cah2 can h promote reduction efficiently absorb water vapor generate reduction
5869,2-s2.0-85140992698,2-s2.0-85140992698,10.1080/17518253.2022.2124889,Sunlight-driven photocatalytic mineralization of antibiotic chemical and selected enteric bacteria in water via zinc tungstate-imprinted kaolinite,2022,2,2024-12-19 15:21:55,publish informa uk limited trading taylor francis group.this study report synthesis sunlight active zinc oxide tungstate kaolinite photocatalytic composite prepare via green process solvent free mechano thermal process optimum temperature 500 ° c h furnace electron paramagnetic resonance epr study suggest presence w5 + w defect state prepare photocatalytic composite znwk responsible photoactivity visible light result analysis show hole h superoxide radical o2− o major contributor photocatalytic efficiency znwk photocatalytic composite photocatalytic composite use treat water contain antibiotic chemical ampicillin amp sunlight mass spectrometry analysis treat water suggest mechanism photodegradation amp via several bond ring cleavage include amide bond phenyl ring β lactam ring cleavage cleavage reaction follow subsequent mineralization can h without formation toxic product introduction phosphate carbonate anion serious negative impact photocatalytic activity composite however photocatalytic composite completely disinfect water contaminate gram gram bacteria even five use cycle photocatalytic composite maintain photodegradation efficiency ampicillin water
8096,2-s2.0-85164171308,2-s2.0-85164171308,10.1002/smsc.202100006,Emerging MXenes for Functional Memories,2021,55,2024-12-19 15:50:30,small science publish wiley vch gmbh.mxenes rapidly grow family 2d material composition morphology structure surface chemistry structural configuration mxene directly affect electrochemical performance example use source drain electrode transistor mxene provide increase chemically active interface reduce ion diffusion length improve inplane carriercharge transport kinetic thus improve storage performance transistor significantly work function bandgap mxenes control tailor structure surface functional group make mxene first choice several storage application herein late progress synthesis property mxene summarize aim boost motivation researcher develop novel mxene improve application emphasize importance mxenes high density datum storage application flash memory memristor application mxenes artificial synapsis neuron logic circuit also discuss future roadmap outline realize storage application mxene
6672,2-s2.0-85121216885,2-s2.0-85121216885,10.3390/su132413779,Future trends and aging analysis of battery energy storage systems for electric vehicles,2021,25,2024-12-19 15:32:34,licensee mdpi basel switzerland.the increase electric vehicle evs environmental concern energy preservation battery selection characteristic demonstrate headway ev development know battery unit require special consideration nature temperature sensitivity age effect degradation cost sustainability hence ev advancement currently concern battery energy accumulate infer evs paper discuss recent trend development battery deployment evs systematic review explicit energy state charge thermal efficiency energy productivity life cycle battery size market revenue security commerciality provide review include battery base energy storage advance development characterization quality power transformation evaluation measure advantage burden ev application study offer guide well battery selection base exceptional performance propose traction application e.g. bevs hevs consider ev advancement subject sustainability issue resource depletion release environment ozone carbon damaging substance study also provide case study age assessment different type battery investigate case study target lithium ion battery cell age analysis influence factor ambient temperature cell temperature charge discharge current parameter show considerable impact life cycle number capacity fade 18.42 25–65 ◦ c observe finally future trend demand lithium ion battery market could increase 2020–2025 light duty heavy duty evs
3345,2-s2.0-85137026476,2-s2.0-85137026476,10.1039/d2ma00653g,Transition metal sulfide/hydroxide electrode materials with high specific capacities,2022,1,2024-12-19 14:48:24,nowadays research energy storage device mainly focus enhance electrochemical performance among electrode material play important role work synthesise several hybrid nico2s4 ni co s ni oh sample three step hydrothermal route electrode material obtain flower like structure accelerate transfer electrolyte ion possess specific capacity 2899.48 f g−1 g−1 superior cycle stability moreover assemble hybrid device obtain energy density 59.26 w h kg−1 1432.07 w kg−1 bend test different angle indicate device possess excellent mechanical flexibility
1295,2-s2.0-85140761299,2-s2.0-85140761299,10.1016/j.jelechem.2022.116875,Multisite engineering towards atomically dispersed Ru on Ni-Co-P composite with N-doped carbon matrix for robust water oxidation,2022,1,2024-12-19 14:17:10,however fundamental understanding source highly active single atom catalyst sacs atomic level still lack herein ultralow ru sacs 0.2 wt anchor transition metal phosphide composite n dope carbon matrix ru ni co pnc derive runi zif via carbonization subsequent phosphating effectively drive oer alkaline electrolyte abundant carbon defect site reorganize electronic structure metal site collectively tailor oer performance ru ni co pnc structure electron modulation expect result ru ni co pnc catalyst deliver mv overpotential afford cm−2 exhibit negligible performance degradation oer finding elucidate rational design multisite nanomaterial efficient electrocatalyst illuminate potential guide meet high performance electrocatalyst
3306,2-s2.0-85136197214,2-s2.0-85136197214,10.34133/2022/9837109,Metal-Organic Frameworks Offering Tunable Binary Active Sites toward Highly Efficient Urea Oxidation Electrolysis,2022,42,2024-12-19 14:47:53,overcome sluggish kinetic catalytically active site rationally design maneuver multiple key step intermediate adsorption desorption herein demonstrate metal organic framework mof provide ideal platform tailor binary active site facilitate rate determine step achieve remarkable electrocatalytic activity toward uor specifically mof namely nimn0.14 ni mn bdc base nimn site terephthalic acid bdc ligand exhibit low voltage 1.317v deliver current density 10macm result high turnover frequency tof 0.15 achieve voltage 1.4 v enable urea degradation rate 81.87 0.33 m urea solution combination experimental characterization theoretical calculation reveal ni mn site play synergistic role maneuver evolution urea molecule key reaction intermediate uor binary nimn site mof offer tunability electronic structure band center impact intermediate evolution work provide important insight active site design leverage mof platform represent solid step toward highly efficient uor mof base electrocatalyst
7708,2-s2.0-85161949826,2-s2.0-85161949826,10.1002/smsc.202100043,Electrocatalytic Reactions for Converting CO2 to Value-Added Products,2021,84,2024-12-19 15:45:55,small science publish wiley vch gmbh.converte co2 c o valuable chemical product intensively explore recent year benefit substantial cost reduction clean electricity electrochemical method emerge potential mean co2 c o conversion fixation direct electrochemical co2 c o reduction reaction co2rr c o r r h2o h o achieve continuously improve efficiency selectivity stability contrast couple co2rr c o r r small molecule organic substrate allow form high valuable chemical still hinder poor selectivity unclear reaction mechanism suboptimal performance electrocatalyst herein development co2rr c o r r electrocatalyst reaction mechanism first introduce several representative example describe emphasizing concept methodology research process reaction mechanism couple co2rr c o r r briefly discuss finally challenge perspective field address inspire development fundamental understanding reaction mechanism couple co2rr c o r r well optimization electrocatalyst electrolyte electrolyzer high activity selectivity
4851,2-s2.0-85135131830,2-s2.0-85135131830,10.1002/smm2.1106,Recent development of nanomaterials for carbon dioxide electroreduction,2022,36,2024-12-19 15:08:48,smartmat publish tianjin university john wiley sons australia ltd.electrochemical co2 c o reduction reaction co2rr c o r r produce value add product receive tremendous research attention recent year research effort across globe remarkable advancement achieve include improvement selectivity reduction product realization efficient reduction beyond two electron delivery industrially relevant current density review introduce recent development nanomaterial co2rr c o r r include zero dimensional graphene quantum dot two dimensional material metal chalcogenide metalcovalent organic framework single atom catalyst nanostructure metal catalyst engineering material three dimensional structure also discuss finally provide summary catalytic performance perspective future development
4665,2-s2.0-85127883825,2-s2.0-85127883825,10.1039/d2ra00757f,Understanding the active sites of Fe-N-C materials and their properties in the ORR catalysis system,2022,12,2024-12-19 15:06:19,zeolitic imidazolate framework zifs type metal organic framework mof select precursor due special structure proper pore size series fe n c catalyst different concentration methylimidazole prepare simple solvothermal pyrolysis method transformation productivity morphology orr activity investigate find fe n c catalyst methylimidazole concentration 0.53 mol l−1 l good performance 0.1 koh solution half wave potential 0.852 v vs. rhe highest electrochemically active surface area ecsa 94.1 cm2 orr reaction dominate electron process current decrease 10.5 chronoamperometry can half wave potential decrease mv methanol additionally catalyst poison cl so32− s o ion orr process finally typical ion include scn fe cn 63− fe cn 64− use inhibit active site determine fe ii real active specie series synthesis testing experiment significance guide optimization synthesis condition analysis mechanism active site fe n c material
3864,2-s2.0-85129337835,2-s2.0-85129337835,10.1021/acs.inorgchem.2c00593,Volatilized Molten Salts: An Alternative Avenue for Synthesizing Single-Phase Perovskites,2022,0,2024-12-19 14:55:25,deleterious lsm formation mss take place liquid phase liclkcl eutectic successfully facilitate lsm formation volatilize specifically kcl evaporate readily licl promote formation lsm via vapor phase time progress licl volatilization increase contribute negatively sr stoichiometry perovskite phase accordance lux flood chemistry product phase purity vmss therefore way obviate immediate restriction lux flood chemistry liquid phase result demonstrate surprising versatility flexibility mss method synthesize numerous potential energy relevant material great ease previously think
